{
    "$schema": "./schema/messages.schema.json",
    "description": "The canonical wording of every user-facing warning and error message both SDKs emit. `template` is the canonical text; `python` and `node` are each SDK's text today, written with the same placeholders, so an SDK can see what changes. A prefix the language adds — Node's `[@stackone/ai] `, Python's logger name — is outside the template. An error's class is in `error`. `matches` says whether an SDK's text is already the canonical one; `notes` say where the text depends on more than the template.",
    "version": 1,
    "prefixes": {
        "node": "Every warning goes through console.warn, prefixed `[@stackone/ai] ` — outside the template.",
        "python": "Every warning is a WARNING record on a `stackone.*` logger; its getMessage() is the template, rendered."
    },
    "formats": {
        "text": "Inserted as is.",
        "json": "Compact JSON text: JSON.stringify(value), json.dumps(value, ensure_ascii=False, separators=(\",\", \":\")). A string comes out in double quotes.",
        "integer": "Decimal digits.",
        "seconds": "A number of seconds as JavaScript's String(number) writes it: 1, 0.5, 1.25 — never 1.0, never padded, never exponent form for values in [1e-6, 1e21).",
        "seconds-2dp": "The seconds rounded half up to two decimals, Math.floor(x * 100 + 0.5) / 100, then written as `seconds`: 0, 0.75, 1.5.",
        "json-type": "The JSON type of the value: object, array, string, number, boolean or null.",
        "reason": "The text for a header reason code, from `reasons`."
    },
    "reasons": {
        "set-by-sdk": "set by the SDK",
        "not-declared": "not declared by the schema",
        "malformed": "malformed",
        "not-an-object": "not an object",
        "not-a-scalar": "not a string, number or boolean"
    },
    "messages": [
        {
            "id": "header-dropped",
            "kind": "warning",
            "template": "Dropping header {header} from a tool call: {reason}",
            "placeholders": {
                "header": {
                    "format": "json",
                    "description": "the nested header name, trimmed"
                },
                "reason": {
                    "format": "reason",
                    "description": "set-by-sdk, not-declared or malformed"
                }
            },
            "python": "Dropping header {header} from a tool call: {reason}",
            "node": "Dropping header {header} from a tool call: {reason}",
            "matches": {
                "python": true,
                "node": true
            },
            "notes": "The name is JSON text, so a quote, a backslash or a control character in it is escaped."
        },
        {
            "id": "header-argument-dropped",
            "kind": "warning",
            "template": "Dropping header argument {argument} from a tool call: {reason}",
            "placeholders": {
                "argument": {
                    "format": "json",
                    "description": "the top-level argument: headers, or headers_<name> as supplied"
                },
                "reason": {
                    "format": "reason",
                    "description": "any reason code"
                }
            },
            "python": "Dropping header argument {argument} from a tool call: {reason}",
            "node": "Dropping header argument {argument} from a tool call: {reason}",
            "matches": {
                "python": true,
                "node": true
            },
            "notes": "The argument is JSON text, as the name in header-dropped is."
        },
        {
            "id": "rate-limit-retry",
            "kind": "warning",
            "template": "{method} {url} was rate limited (429) on attempt {attempt} of {max_attempts}; retrying in {delay}s",
            "placeholders": {
                "method": {
                    "format": "text",
                    "description": "the HTTP method"
                },
                "url": {
                    "format": "text",
                    "description": "the request URL"
                },
                "attempt": {
                    "format": "integer",
                    "description": "the attempt that was answered 429, 1-based"
                },
                "max_attempts": {
                    "format": "integer",
                    "description": "4"
                },
                "delay": {
                    "format": "seconds-2dp",
                    "description": "the wait before the next attempt"
                }
            },
            "python": "{method} {url} was rate limited (429) on attempt {attempt} of {max_attempts}; retrying in {delay}s",
            "node": "{method} {url} was rate limited (429) on attempt {attempt} of {max_attempts}; retrying in {delay}s",
            "matches": {
                "python": true,
                "node": true
            },
            "notes": "Names the attempt that was answered 429, not the one about to be made."
        },
        {
            "id": "rate-limit-deadline",
            "kind": "warning",
            "template": "{method} {url} was rate limited (429) on attempt {attempt} of {max_attempts}; not retrying, because waiting {delay}s would pass the deadline",
            "placeholders": {
                "method": {
                    "format": "text",
                    "description": "the HTTP method"
                },
                "url": {
                    "format": "text",
                    "description": "the request URL"
                },
                "attempt": {
                    "format": "integer",
                    "description": "the attempt that was answered 429, 1-based"
                },
                "max_attempts": {
                    "format": "integer",
                    "description": "4"
                },
                "delay": {
                    "format": "seconds-2dp",
                    "description": "the wait before the next attempt that would pass the deadline"
                }
            },
            "python": "{method} {url} was rate limited (429) on attempt {attempt} of {max_attempts}; not retrying, because waiting {delay}s would pass the deadline",
            "node": "{method} {url} was rate limited (429) on attempt {attempt} of {max_attempts}; not retrying, because waiting {delay}s would pass the deadline",
            "matches": {
                "python": true,
                "node": true
            },
            "notes": "When the next wait would not finish before the call's deadline, the SDK ends the call with the 429 it already has instead of sleeping, and warns this in place of rate-limit-retry."
        },
        {
            "id": "account-id-env-ignored",
            "kind": "warning",
            "template": "STACKONE_ACCOUNT_ID is set, but the SDK does not read it: with no account id passed, every active shared account on this API key is used. Pass an account id to scope the toolset.",
            "placeholders": {},
            "python": "STACKONE_ACCOUNT_ID is set, but the SDK does not read it: with no account id passed, every active shared account on this API key is used. Pass an account id to scope the toolset.",
            "node": "STACKONE_ACCOUNT_ID is set, but the SDK does not read it: with no account id passed, every active shared account on this API key is used. Pass an account id to scope the toolset.",
            "matches": {
                "python": true,
                "node": true
            },
            "notes": "Emitted once, when the toolset is constructed, if the STACKONE_ACCOUNT_ID environment variable is set and non-empty and neither an account id nor account ids were passed."
        },
        {
            "id": "skip-account",
            "kind": "warning",
            "template": "Skipping account that failed to list tools — {account_id}: {error}",
            "placeholders": {
                "account_id": {
                    "format": "text",
                    "description": "the account's id"
                },
                "error": {
                    "format": "text",
                    "description": "the failure's own message"
                }
            },
            "python": "Skipping account that failed to list tools — {account_id}: {error}",
            "node": "Skipping account that failed to list tools — {account_id}: {error}",
            "matches": {
                "python": true,
                "node": true
            },
            "notes": "Individual mode only: a search_execute listing is one request for the whole scope, and its failure raises. The error part is whichever message the failure carries, so the whole text is the same in both SDKs only where that message is."
        },
        {
            "id": "duplicate-tool-names",
            "kind": "warning",
            "template": "{count} tool name(s) are served by more than one account ({names}). The first one listed, from the lowest account id, is used — pass account ids to choose.",
            "placeholders": {
                "count": {
                    "format": "integer",
                    "description": "how many names clash"
                },
                "names": {
                    "format": "text",
                    "description": "up to five of them, sorted, joined by \", \""
                }
            },
            "python": "{count} tool name(s) are served by more than one account ({names}). The first one listed, from the lowest account id, is used — pass account ids to choose.",
            "node": "{count} tool name(s) are served by more than one account ({names}). The first one listed, from the lowest account id, is used — pass account ids to choose.",
            "matches": {
                "python": true,
                "node": true
            },